[
  {
    "repo": ".github",
    "kind": "workflow",
    "from": ".github/workflows/ci.yml",
    "to": ".github/workflows/pr-require-checks.yml",
    "from_name": "ci",
    "to_name": "pr-require-checks",
    "job_renames": [
      {
        "from": "markdown",
        "to": "markdownlint"
      },
      {
        "from": "editorconfig",
        "to": "editorconfig-checker"
      },
      {
        "from": "links",
        "to": "check-links"
      },
      {
        "from": "eol-renormalize",
        "to": "check-line-endings"
      },
      {
        "from": "pr-section-drift",
        "to": "check-pr-sections"
      }
    ],
    "couplings": ["GOV"],
    "confidence": "high",
    "note": "Holds the lanes and the ci-status aggregate; also runs on push to main; job pr-section-drift is advisory (not in ci-status needs) and becomes check-pr-sections"
  },
  {
    "repo": ".github",
    "kind": "workflow",
    "from": ".github/workflows/managed-files-guard.yml",
    "to": ".github/workflows/pr-check-managed-files-hosted.yml",
    "from_name": "managed-files-guard",
    "to_name": "pr-check-managed-files-hosted",
    "job_renames": [
      {
        "from": "managed-files-guard",
        "to": "pr-check-managed-files"
      }
    ],
    "couplings": ["SYNC", "MFG", "HOSTED-FLEET"],
    "confidence": "high",
    "note": "Thin caller of the check-managed-files composite; job id = slot; the advisory check context moves from `managed-files-guard` to `pr-check-managed-files`; the hosted and fleet callers keep separate files (`-hosted` stem for the hosted one) with the same job id, so the same check context (Q5 (b) supersedes D13)"
  },
  {
    "repo": "agent-plugins",
    "kind": "workflow",
    "from": ".github/workflows/ci.yml",
    "to": ".github/workflows/pr-require-checks.yml",
    "from_name": "ci",
    "to_name": "pr-require-checks",
    "job_renames": [
      {
        "from": "scripts",
        "to": "check-scripts-and-manifests"
      }
    ],
    "couplings": ["GOV"],
    "confidence": "high",
    "note": "Holds the lanes and the ci-status aggregate; also runs on push to main; also merge_group; job `scripts` runs shellcheck, bash -n and jq well-formedness checks"
  },
  {
    "repo": "agent-plugins",
    "kind": "workflow",
    "from": ".github/workflows/claude-review-hosted.yml",
    "to": ".github/workflows/pr-review-hosted.yml",
    "from_name": "claude-review",
    "to_name": "pr-review-hosted",
    "job_renames": [
      {
        "from": "review",
        "to": "pr-review"
      }
    ],
    "couplings": ["TRIGGER", "SYNC", "MFG", "REPIN", "PIN", "RP-std", "HOSTED-FLEET"],
    "confidence": "high",
    "note": "Caller takes the reusable filename; the hosted and fleet callers keep separate files (`-hosted` stem for the hosted one) with the same job id, so the same check context (Q5 (b) supersedes D13)"
  },
  {
    "repo": "agent-plugins",
    "kind": "workflow",
    "from": ".github/workflows/claude-security-review-hosted.yml",
    "to": ".github/workflows/pr-review-security-hosted.yml",
    "from_name": "claude-security-review",
    "to_name": "pr-review-security-hosted",
    "job_renames": [
      {
        "from": "security-review",
        "to": "pr-review-security"
      }
    ],
    "couplings": ["TRIGGER", "SYNC", "MFG", "REPIN", "PIN", "RP-std", "RC", "HOSTED-FLEET"],
    "confidence": "high",
    "note": "Caller job id = slot `pr-review-security`; reusable engine job `claude` keeps the display name `security-review`, so context `security-review / security-review` becomes `pr-review-security / security-review` (security-review-gate ruleset, github-iac OrgRulesets.cs:141, enforcement disabled; claude-code-plugins ADR 0002)"
  },
  {
    "repo": "agent-plugins",
    "kind": "workflow",
    "from": ".github/workflows/managed-files-guard.yml",
    "to": ".github/workflows/pr-check-managed-files-hosted.yml",
    "from_name": "managed-files-guard",
    "to_name": "pr-check-managed-files-hosted",
    "job_renames": [
      {
        "from": "managed-files-guard",
        "to": "pr-check-managed-files"
      }
    ],
    "couplings": ["SYNC", "MFG", "HOSTED-FLEET"],
    "confidence": "high",
    "note": "Thin caller of the check-managed-files composite; job id = slot; the advisory check context moves from `managed-files-guard` to `pr-check-managed-files`; the hosted and fleet callers keep separate files (`-hosted` stem for the hosted one) with the same job id, so the same check context (Q5 (b) supersedes D13)"
  },
  {
    "repo": "ci-runner",
    "kind": "workflow",
    "from": ".github/workflows/ci.yml",
    "to": ".github/workflows/pr-require-checks.yml",
    "from_name": "ci",
    "to_name": "pr-require-checks",
    "job_renames": [
      {
        "from": "markdown",
        "to": "markdownlint"
      },
      {
        "from": "editorconfig",
        "to": "editorconfig-checker"
      },
      {
        "from": "comment-hygiene",
        "to": "check-comment-markers"
      },
      {
        "from": "exec-bit",
        "to": "check-exec-bit"
      },
      {
        "from": "machine-specific-paths",
        "to": "check-machine-paths"
      },
      {
        "from": "eol-renormalize",
        "to": "check-line-endings"
      },
      {
        "from": "zizmor",
        "to": "pr-audit-workflows"
      },
      {
        "from": "go-quality",
        "to": "pr-run-checks-go"
      },
      {
        "from": "policy",
        "to": "test-policy-contracts"
      },
      {
        "from": "go-windows-build",
        "to": "build-go-windows"
      },
      {
        "from": "go-fuzz",
        "to": "fuzz-go"
      },
      {
        "from": "worker-image",
        "to": "build-worker-image"
      },
      {
        "from": "dependency-review",
        "to": "review-dependencies"
      }
    ],
    "couplings": ["GOV"],
    "confidence": "high",
    "note": "Holds the lanes and the ci-status aggregate; also runs on push to main; also weekly schedule (Mon 05:30) and workflow_dispatch"
  },
  {
    "repo": "ci-runner",
    "kind": "workflow",
    "from": ".github/workflows/claude-review-hosted.yml",
    "to": ".github/workflows/pr-review-hosted.yml",
    "from_name": "claude-review",
    "to_name": "pr-review-hosted",
    "job_renames": [
      {
        "from": "review",
        "to": "pr-review"
      }
    ],
    "couplings": ["TRIGGER", "SYNC", "MFG", "REPIN", "PIN", "RP-std", "HOSTED-FLEET"],
    "confidence": "high",
    "note": "Caller takes the reusable filename; the hosted and fleet callers keep separate files (`-hosted` stem for the hosted one) with the same job id, so the same check context (Q5 (b) supersedes D13)"
  },
  {
    "repo": "ci-runner",
    "kind": "workflow",
    "from": ".github/workflows/claude-security-review-hosted.yml",
    "to": ".github/workflows/pr-review-security-hosted.yml",
    "from_name": "claude-security-review",
    "to_name": "pr-review-security-hosted",
    "job_renames": [
      {
        "from": "security-review",
        "to": "pr-review-security"
      }
    ],
    "couplings": ["TRIGGER", "SYNC", "MFG", "REPIN", "PIN", "RP-std", "RC", "HOSTED-FLEET"],
    "confidence": "high",
    "note": "Caller job id = slot `pr-review-security`; reusable engine job `claude` keeps the display name `security-review`, so context `security-review / security-review` becomes `pr-review-security / security-review` (security-review-gate ruleset, github-iac OrgRulesets.cs:141, enforcement disabled; claude-code-plugins ADR 0002)"
  },
  {
    "repo": "ci-runner",
    "kind": "workflow",
    "from": ".github/workflows/managed-files-guard.yml",
    "to": ".github/workflows/pr-check-managed-files-hosted.yml",
    "from_name": "managed-files-guard",
    "to_name": "pr-check-managed-files-hosted",
    "job_renames": [
      {
        "from": "managed-files-guard",
        "to": "pr-check-managed-files"
      }
    ],
    "couplings": ["SYNC", "MFG", "HOSTED-FLEET"],
    "confidence": "high",
    "note": "Thin caller of the check-managed-files composite; job id = slot; the advisory check context moves from `managed-files-guard` to `pr-check-managed-files`; the hosted and fleet callers keep separate files (`-hosted` stem for the hosted one) with the same job id, so the same check context (Q5 (b) supersedes D13)"
  },
  {
    "repo": "ci-runner",
    "kind": "workflow",
    "from": ".github/workflows/release.yml",
    "to": ".github/workflows/release-publish-image.yml",
    "from_name": "Release",
    "to_name": "release-publish-image",
    "job_renames": [],
    "couplings": ["ACTIONLINT", "RC"],
    "confidence": "high",
    "note": "On v* tag: verify tagged source, publish evidence, promote the worker OCI image; name: `Release` becomes the stem. Tag ruleset ci-runner-release-tags keys on refs, not the file"
  },
  {
    "repo": "ci-workflows",
    "kind": "workflow",
    "from": ".github/workflows/ci.yml",
    "to": ".github/workflows/pr-require-checks.yml",
    "from_name": "ci",
    "to_name": "pr-require-checks",
    "job_renames": [
      {
        "from": "changes",
        "to": "detect-changes"
      },
      {
        "from": "checks",
        "to": "pr-run-checks"
      },
      {
        "from": "composites-head",
        "to": "test-composites-head"
      },
      {
        "from": "powershell",
        "to": "psscriptanalyzer"
      },
      {
        "from": "reference-integrity",
        "to": "check-markdown-references"
      },
      {
        "from": "action-metadata-filename",
        "to": "check-action-filename"
      },
      {
        "from": "managed-files-guard",
        "to": "check-managed-files"
      },
      {
        "from": "selector-contract",
        "to": "test-contracts"
      },
      {
        "from": "zizmor",
        "to": "pr-audit-workflows"
      },
      {
        "from": "osv-scanner",
        "to": "pr-scan-dependencies"
      },
      {
        "from": "go-quality-dogfood",
        "to": "pr-run-checks-go"
      }
    ],